{"sample_id":"44444444-4444-4444-8444-444444444444","source_id":"33333333-3333-4333-8333-333333333333","audio_path":"object://example/sample-0001","duration":2.4,"language":"ko-KR","raw_text":"안녕하세요","spoken_text":"안녕하세요","normalized_text":"안녕하세요","character_id":"miku","emotion":"friendly","speech_likeness":1.0,"singing_likeness":0.0,"quality_score":0.95,"alignment_score":0.98,"rights_status":"owned","status":"accepted"}
